{"actor":"human:owner","body":"orphan observed on subject with existing head","content_hash":"sha256:312aa138bf7896fd331c93e1be4e0884b84ed2cc1570982cc616eb38ab0ec45c","event_id":"evt-bbbbbbbbbbbbbbbbbbbbbbbbbbbbbbbb","extensions":{"observed_at":"2026-08-30T00:05:30Z","observed_post_identity":"sha256:ffffffffffffffffffffffffffffffffffffffffffffffffffffffffffffffff","path":"src/legit.py"},"prior_refs":{"parent":[],"supports":[]},"receipt_class":"observed","recorded_at":"2026-08-30T00:06:00Z","schema_version":"0.3.2","subject":"src/legit.py","subtype":"orphan-observed","type":"CHANGE"}
