{"actor":"human:owner","body":"first replacement (ordered first by recorded_at)","content_hash":"sha256:49fce62eefd273dba0bb5716bb5ad7cf3882cfde90842d68ea1b2c0abd6a14ac","event_id":"evt-dddddddddddddddddddddddddddddddd","extensions":{"x_reclassified_from":"evt-44444444444444444444444444444444"},"prior_refs":{"parent":[],"supports":["evt-55555555555555555555555555555555"]},"receipt_class":"claim","recorded_at":"2026-08-30T00:02:00Z","schema_version":"0.3.2","subject":"task:fixlater","subtype":"dispatch","type":"TASK"}
