{"actor":"human:owner","body":"reconciliation genesis head for orphan subject","content_hash":"sha256:e676e1a73ee57d568a88059c3f84ab430046851cf7f770dd1bfcd8b3a0c1d775","event_id":"evt-88888888888888888888888888888888","extensions":{"observed_at":"2026-08-29T22:00:00Z","path":"src/lonely.py","post_identity":"sha256:aaaaaaaaaaaaaaaaaaaaaaaaaaaaaaaaaaaaaaaaaaaaaaaaaaaaaaaaaaaaaaaa","recorded_at_reason":"manual backfill of observed out-of-band edit; no retroactive authorization"},"prior_refs":{"parent":[],"supports":["evt-77777777777777777777777777777777"]},"receipt_class":"claim","recorded_at":"2026-08-30T00:04:00Z","schema_version":"0.3.2","subject":"src/lonely.py","subtype":"reconciliation","type":"CHANGE"}
