{"actor":"human:owner","body":"non_state corrective record","content_hash":"sha256:858ad61faa0bf689abf5382bbf4551ade52b3ac23c7b48d6a5a521f3c94173c5","event_id":"evt-55555555555555555555555555555555","extensions":{"x_reclassifies":"evt-44444444444444444444444444444444","x_replacement_event_id":"evt-66666666666666666666666666666666"},"prior_refs":{"parent":[],"supports":["evt-44444444444444444444444444444444"]},"receipt_class":"claim","recorded_at":"2026-08-30T00:01:00Z","schema_version":"0.3.2","subject":"task:fixlater","subtype":"reclassify","type":"CHANGE"}
