{"actor":"human:owner","body":"orphan observed: governed path modified without prior canonical event","content_hash":"sha256:7f215624bd3fe92505f197c88cfa3501b011b8f8984b43a88064d185b08823fc","event_id":"evt-77777777777777777777777777777777","extensions":{"observed_at":"2026-08-29T22:00:00Z","observed_post_identity":"sha256:aaaaaaaaaaaaaaaaaaaaaaaaaaaaaaaaaaaaaaaaaaaaaaaaaaaaaaaaaaaaaaaa","path":"src/lonely.py"},"prior_refs":{"parent":[],"supports":[]},"receipt_class":"observed","recorded_at":"2026-08-30T00:03:00Z","schema_version":"0.3.2","subject":"src/lonely.py","subtype":"orphan-observed","type":"CHANGE"}
