{"actor":"human:owner","body":"existing head","content_hash":"sha256:753fc1f09cd4b8efd4bd1b24231358a0961dedce3cd9d7bb85aaf7770f43ab96","event_id":"evt-99999999999999999999999999999999","extensions":{"path":"src/legit.py"},"prior_refs":{"parent":[],"supports":[]},"receipt_class":"claim","recorded_at":"2026-08-30T00:05:00Z","schema_version":"0.3.2","subject":"src/legit.py","subtype":"dispatch","type":"TASK"}
