{"actor":"human:owner","body":"","content_hash":"sha256:27659e7465cf719caa5b7d1fd1b888074992daafa47f3cc881dafe526db1c334","event_id":"evt-cccccccccccccccccccccccccccccccc","extensions":{"min_safe":-9007199254740991},"prior_refs":{"parent":[],"supports":[]},"receipt_class":"claim","recorded_at":"2026-08-30T00:00:00Z","schema_version":"0.3.2","subject":"task:intmin","subtype":"checkpoint-recorded","type":"CHANGE"}
