{"actor":"human:owner","body":"reconciliation with existing head","content_hash":"sha256:f9beb4d3fa9e67654770def837ee2d84e5027e9a93a9e1495fd21e365b9041d6","event_id":"evt-ccccccccccccccccccccccccccccccca","extensions":{"observed_at":"2026-08-30T00:05:30Z","path":"src/legit.py","post_identity":"sha256:ffffffffffffffffffffffffffffffffffffffffffffffffffffffffffffffff","recorded_at_reason":"manual backfill on subject with existing head; references current head"},"prior_refs":{"parent":["evt-99999999999999999999999999999999"],"supports":["evt-bbbbbbbbbbbbbbbbbbbbbbbbbbbbbbbb"]},"receipt_class":"claim","recorded_at":"2026-08-30T00:07:00Z","schema_version":"0.3.2","subject":"src/legit.py","subtype":"reconciliation","type":"CHANGE"}
