{"actor":"human:owner","body":"second replacement (ordered later by recorded_at)","content_hash":"sha256:360dbd5e9c335085de5be35a301ae8fd7e5ee6f7421cb354008b9a0ad60b28e0","event_id":"evt-eeeeeeeeeeeeeeeeeeeeeeeeeeeeeeee","extensions":{"x_reclassified_from":"evt-44444444444444444444444444444444"},"prior_refs":{"parent":[],"supports":["evt-55555555555555555555555555555555"]},"receipt_class":"claim","recorded_at":"2026-08-30T00:03:00Z","schema_version":"0.3.2","subject":"task:fixlater","subtype":"dispatch","type":"TASK"}
