{"actor":"human:owner","body":"human readable description","content_hash":"sha256:0aea0555bac30cdfdb2705ddbb5cf4124948a1901c33feb0ecb4db79a2c2d334","event_id":"evt-3f2b8c9a1d4e5f60718293a4b5c6d7e8","extensions":{"effect":[{"change":"modified","path":"src/fib.py","post_identity":"sha256:0000000000000000000000000000000000000000000000000000000000000000"}],"x_priority":7},"prior_refs":{"parent":["evt-aaaaaaaaaaaaaaaaaaaaaaaaaaaaaaaa"],"supports":["evt-bbbbbbbbbbbbbbbbbbbbbbbbbbbbbbbb","evt-cccccccccccccccccccccccccccccccc"]},"receipt_class":"claim","recorded_at":"2026-08-30T00:00:00Z","schema_version":"0.3.2","subject":"task:fib","subtype":"dispatch","type":"TASK"}
