{"actor":"human:owner","body":"","content_hash":"sha256:ef16091eec4b5049e3297635897ba019c1727335b68774fcd3627958751998e4","event_id":"evt-aaaaaaaaaaaaaaaaaaaaaaaaaaaaaaac","extensions":{"🀀second":"y","first":"x"},"prior_refs":{"parent":[],"supports":[]},"receipt_class":"claim","recorded_at":"2026-08-30T00:00:00Z","schema_version":"0.3.2","subject":"task:utf16discr","subtype":"checkpoint-recorded","type":"CHANGE"}
