{"actor":"human:owner","body":"original unknown subtype; no formal effect","content_hash":"sha256:db79735f918a5757f15d11f43fb2c1a3209d0c2e98121d4f798d253c930e0866","event_id":"evt-44444444444444444444444444444444","extensions":{},"prior_refs":{"parent":[],"supports":[]},"receipt_class":"claim","recorded_at":"2026-08-30T00:00:00Z","schema_version":"0.3.2","subject":"task:fixlater","subtype":"reclassify-source","type":"CHANGE"}
