{"actor":"human:owner","body":"","content_hash":"sha256:939f1ff3984a60e554851fb4e1d9a8b2821e17e7980600c36e4371abde08cbad","event_id":"evt-aaaaaaaaaaaaaaaaaaaaaaaaaaaaaaab","extensions":{"a_before_emoji":"value2","z_after_emoji_😀_x":"value1"},"prior_refs":{"parent":[],"supports":[]},"receipt_class":"claim","recorded_at":"2026-08-30T00:00:00Z","schema_version":"0.3.2","subject":"task:nf","subtype":"dispatch","type":"TASK"}
