{"actor":"human:owner","body":"","content_hash":"sha256:0b596357e0945ea511a24053e91e6d491ac89c68accd407d9d8de078e31e242a","event_id":"evt-eeeeeeeeeeeeeeeeeeeeeeeeeeeeeeee","extensions":{"big_typed_string":"9007199254740992","x_type":"bigint-overflow"},"prior_refs":{"parent":[],"supports":[]},"receipt_class":"claim","recorded_at":"2026-08-30T00:00:00Z","schema_version":"0.3.2","subject":"task:overflow_string","subtype":"checkpoint-recorded","type":"CHANGE"}
