{"actor":"human:owner","body":"replacement event - only this participates in fold","content_hash":"sha256:be9c2366641d4a9b543de1fe8295f4e8a65357fc757331c5f7ae8a6ddbacdbb5","event_id":"evt-66666666666666666666666666666666","extensions":{"x_reclassified_from":"evt-44444444444444444444444444444444"},"prior_refs":{"parent":[],"supports":["evt-55555555555555555555555555555555"]},"receipt_class":"claim","recorded_at":"2026-08-30T00:02:00Z","schema_version":"0.3.2","subject":"task:fixlater","subtype":"dispatch","type":"TASK"}
