{"actor":"human:owner","body":"","content_hash":"sha256:c5dd76e77a1d1abd8fd10b48bb6cf95e5b9c85b2b9b6291702bf970012092603","event_id":"evt-bbbbbbbbbbbbbbbbbbbbbbbbbbbbbbbb","extensions":{"max_safe":9007199254740991},"prior_refs":{"parent":[],"supports":[]},"receipt_class":"claim","recorded_at":"2026-08-30T00:00:00Z","schema_version":"0.3.2","subject":"task:intmax","subtype":"checkpoint-recorded","type":"CHANGE"}
